{
 "$schema": "./schemas/tokens.schema.json",
 "name": "Aleron MD Product Design System Tokens",
 "version": "0.5.0",
 "updated": "2026-07-17",
 "description": "Canonical primitive and semantic tokens used by the reference page and agent-built prototypes.",
 "font_faces": [
  {
   "family": "PolySans",
   "src": "fonts/PolySans-Slim.ttf",
   "weight": 300,
   "style": "normal"
  },
  {
   "family": "PolySans",
   "src": "fonts/PolySans-Neutral.ttf",
   "weight": 400,
   "style": "normal"
  },
  {
   "family": "PolySans",
   "src": "fonts/PolySans-NeutralItalic.ttf",
   "weight": 400,
   "style": "italic"
  },
  {
   "family": "PolySans",
   "src": "fonts/PolySans-Median.ttf",
   "weight": 500,
   "style": "normal"
  },
  {
   "family": "PolySans",
   "src": "fonts/PolySans-MedianItalic.ttf",
   "weight": 500,
   "style": "italic"
  },
  {
   "family": "PolySans",
   "src": "fonts/PolySans-Bulky.ttf",
   "weight": 700,
   "style": "normal"
  }
 ],
 "tokens": {
  "color": {
   "paper": {
    "$type": "color",
    "$value": "#FAF7F2",
    "css": "--paper",
    "description": "Day ground",
    "status": "ratified"
   },
   "ink": {
    "$type": "color",
    "$value": "#1D1B18",
    "css": "--ink",
    "description": "Day text and primary control",
    "status": "ratified"
   },
   "cream": {
    "$type": "color",
    "$value": "#F5F1E8",
    "css": "--cream",
    "description": "Night text",
    "status": "ratified"
   },
   "graphite": {
    "$type": "color",
    "$value": "#15171C",
    "css": "--graphite",
    "description": "Dark weave",
    "status": "ratified"
   },
   "gunmetal": {
    "$type": "color",
    "$value": "#333E48",
    "css": "--gunmetal",
    "description": "Elevated dark surface",
    "status": "ratified"
   },
   "steel": {
    "$type": "color",
    "$value": "#46555F",
    "css": "--steel",
    "description": "Light weave",
    "status": "ratified"
   },
   "navy": {
    "$type": "color",
    "$value": "#252B3D",
    "css": "--navy",
    "description": "Flight-deck ground",
    "status": "ratified"
   },
   "slate": {
    "$type": "color",
    "$value": "#5A6378",
    "css": "--slate",
    "description": "Day labels and baseline",
    "status": "ratified"
   },
   "gold": {
    "$type": "color",
    "$value": "#C9A14E",
    "css": "--gold",
    "description": "Forward signal, never a control",
    "status": "ratified"
   },
   "litGold": {
    "$type": "color",
    "$value": "#EACB7F",
    "css": "--lit-gold",
    "description": "Advisory on dark",
    "status": "ratified"
   },
   "textGold": {
    "$type": "color",
    "$value": "#8A6A2F",
    "css": "--text-gold",
    "description": "Advisory text on light",
    "status": "ratified"
   },
   "gold800": {
    "$type": "color",
    "$value": "#655127",
    "css": "--gold-800",
    "description": "Advisory text on inset",
    "status": "ratified"
   },
   "ember": {
    "$type": "color",
    "$value": "#A4452C",
    "css": "--ember",
    "description": "Hazard only",
    "status": "ratified"
   },
   "unmodeled": {
    "$type": "color",
    "$value": "#4A6FA5",
    "css": "--signal-unmodeled",
    "description": "Unmodeled window",
    "status": "provisional"
   },
   "dayTertiary": {
    "$type": "color",
    "$value": "#6E6A63",
    "css": "--day-text-tertiary",
    "description": "Lowest legal reading gray on paper",
    "status": "ratified"
   },
   "dayCard": {
    "$type": "color",
    "$value": "#FFFFFF",
    "css": "--day-surface-card",
    "description": "Day Tier 1 surface",
    "status": "ratified"
   },
   "dayInset": {
    "$type": "color",
    "$value": "#F1EDE6",
    "css": "--day-surface-inset",
    "description": "Day inset surface",
    "status": "ratified"
   },
   "nightInset": {
    "$type": "color",
    "$value": "#20253A",
    "css": "--night-surface-inset",
    "description": "Flight-deck inset surface",
    "status": "ratified"
   },
   "nightSunken": {
    "$type": "color",
    "$value": "#1C2030",
    "css": "--night-surface-sunken",
    "description": "Flight-deck sunken surface",
    "status": "ratified"
   }
  },
  "font": {
   "voice": {
    "$type": "fontFamily",
    "$value": "'PolySans', 'Hanken Grotesk', -apple-system, BlinkMacSystemFont, sans-serif",
    "css": "--voice",
    "description": "Product voice family",
    "status": "ratified"
   },
   "audit": {
    "$type": "fontFamily",
    "$value": "'Space Mono', ui-monospace, Menlo, monospace",
    "css": "--audit",
    "description": "Wordmark tag only",
    "status": "ratified"
   }
  },
  "size": {
   "display": {
    "$type": "dimension",
    "$value": "clamp(32px, 4vw, 48px)",
    "css": "--size-display",
    "description": "Display size",
    "status": "ratified"
   },
   "h1": {
    "$type": "dimension",
    "$value": "36px",
    "css": "--size-h1",
    "description": "Heading 1",
    "status": "ratified"
   },
   "h2": {
    "$type": "dimension",
    "$value": "26px",
    "css": "--size-h2",
    "description": "Heading 2",
    "status": "ratified"
   },
   "h3": {
    "$type": "dimension",
    "$value": "19px",
    "css": "--size-h3",
    "description": "Heading 3",
    "status": "ratified"
   },
   "lede": {
    "$type": "dimension",
    "$value": "18px",
    "css": "--size-lede",
    "description": "Lead text",
    "status": "ratified"
   },
   "text": {
    "$type": "dimension",
    "$value": "15.5px",
    "css": "--size-text",
    "description": "Body text",
    "status": "ratified"
   },
   "small": {
    "$type": "dimension",
    "$value": "13px",
    "css": "--size-small",
    "description": "Small text",
    "status": "ratified"
   },
   "audit": {
    "$type": "dimension",
    "$value": "11.5px",
    "css": "--size-audit",
    "description": "Tabular audit text",
    "status": "ratified"
   },
   "caption": {
    "$type": "dimension",
    "$value": "10.5px",
    "css": "--size-caption",
    "description": "Functional floor",
    "status": "ratified"
   }
  },
  "space": {
   "2xs": {
    "$type": "dimension",
    "$value": "4px",
    "css": "--s-2xs",
    "description": "4 px grid unit",
    "status": "ratified"
   },
   "xs": {
    "$type": "dimension",
    "$value": "8px",
    "css": "--s-xs",
    "description": "Spacing step",
    "status": "ratified"
   },
   "sm": {
    "$type": "dimension",
    "$value": "12px",
    "css": "--s-sm",
    "description": "Spacing step",
    "status": "ratified"
   },
   "md": {
    "$type": "dimension",
    "$value": "16px",
    "css": "--s-md",
    "description": "Spacing step",
    "status": "ratified"
   },
   "lg": {
    "$type": "dimension",
    "$value": "24px",
    "css": "--s-lg",
    "description": "Spacing step",
    "status": "ratified"
   },
   "xl": {
    "$type": "dimension",
    "$value": "32px",
    "css": "--s-xl",
    "description": "Spacing step",
    "status": "ratified"
   },
   "2xl": {
    "$type": "dimension",
    "$value": "48px",
    "css": "--s-2xl",
    "description": "Spacing step",
    "status": "ratified"
   },
   "3xl": {
    "$type": "dimension",
    "$value": "64px",
    "css": "--s-3xl",
    "description": "Spacing step",
    "status": "ratified"
   }
  },
  "air": {
   "row": {
    "$type": "dimension",
    "$value": "9px",
    "css": "--air-row",
    "description": "Within a group",
    "status": "provisional"
   },
   "group": {
    "$type": "dimension",
    "$value": "26px",
    "css": "--air-group",
    "description": "Into a new group",
    "status": "provisional"
   },
   "tier": {
    "$type": "dimension",
    "$value": "20px",
    "css": "--air-tier",
    "description": "Between sibling blocks",
    "status": "provisional"
   },
   "section": {
    "$type": "dimension",
    "$value": "44px",
    "css": "--air-section",
    "description": "Into a new section",
    "status": "provisional"
   }
  },
  "layout": {
   "nav": {
    "$type": "dimension",
    "$value": "188px",
    "css": "--nav-w",
    "description": "Reference navigation width. Fixed by rail rule R1 (188px on desktop).",
    "status": "ratified"
   },
   "railHinge": {
    "$type": "dimension",
    "$value": "760px",
    "css": "--rail-hinge",
    "description": "Below this content width the rail yields to the mobile bar. Proposed 17 Jul 2026.",
    "status": "provisional"
   },
   "pageMax": {
    "$type": "dimension",
    "$value": "1240px",
    "css": "--page-max",
    "description": "Reference content maximum",
    "status": "ratified"
   }
  },
  "layer": {
   "raised": {
    "$type": "dimension",
    "$value": "100",
    "css": "--z-raised",
    "description": "Floating elements above layout: toast, AI launcher. These carry the only shadows besides Tier 1. Proposed 17 Jul 2026.",
    "status": "provisional"
   },
   "overlay": {
    "$type": "dimension",
    "$value": "200",
    "css": "--z-overlay",
    "description": "Modal scrim and sheet. Sits above raised; one overlay at a time. Proposed 17 Jul 2026.",
    "status": "provisional"
   }
  },
  "radius": {
   "panel": {
    "$type": "dimension",
    "$value": "18px",
    "css": "--radius-panel",
    "description": "Panel",
    "status": "ratified"
   },
   "tier1": {
    "$type": "dimension",
    "$value": "16px",
    "css": "--radius-tier1",
    "description": "Elevated card",
    "status": "ratified"
   },
   "tier2": {
    "$type": "dimension",
    "$value": "12px",
    "css": "--radius-tier2",
    "description": "Inset card",
    "status": "ratified"
   },
   "control": {
    "$type": "dimension",
    "$value": "10px",
    "css": "--radius-control",
    "description": "Control",
    "status": "ratified"
   },
   "tile": {
    "$type": "dimension",
    "$value": "4px",
    "css": "--radius-tile",
    "description": "Hazard and compact tile",
    "status": "ratified"
   }
  },
  "line": {
   "thin": {
    "$type": "dimension",
    "$value": "1px",
    "css": "--line-thin",
    "description": "Hairline",
    "status": "ratified"
   },
   "focus": {
    "$type": "dimension",
    "$value": "2px",
    "css": "--line-focus",